"title","heading","content"
"Iniciativas para Mitigar os Impactos da COVID-19","e","O início de 2020 foi marcado pela pandemia da COVID-19, que afetou todo mundo e também a Taesa. Desde então, a Companhia vem adotando medidas para a proteção, segurança e saúde de seus colaboradores, suas famílias e as comunidades locais, a fim de proteger seu maior ativo – as pessoas – e reduzir a velocidade de disseminação do novo coronavírus no país. Assim, destacamos as principais medidas implementadas até o momento: Proteção da saúde dos colaboradores Adoção de medidas para resguardar nosso maior ativo, as pessoas, e garantir a continuidade das nossas operações; Comunicação frequente e atualizada para todos os colaboradores sobre orientações de saúde e higiene; Retorno às atividades em modelo híbrido, intercalando presencial com home office e mantendo todos os protocolos de segurança e saúde necessários; Monitoramento dos empregados com apoio no tratamento de casos suspeitos ou positivos identificados da COVID-19; Disponibilização de diversos canais de atendimento para cuidar da saúde física e mental dos colaboradores e de seus familiares; Vacinação anual contra a gripe influenza para todos; Reforço na comunicação sobre a importância do atendimento às medidas de proteção e cuidado (Campanha “Eu cuido de você e você cuida de mim”); Incentivo à imunização completa: 99,6% dos colaboradores com o esquema primário completo, 97,6% com primeira dose de reforço e 49,9% com a segunda dose de reforço entre os colaboradores a partir de 40 anos. Reforço de informações sobre os cuidados preventivos que devem continuar no pós vacina. Continuidade das operações e dos empreendimentos em construção Criação do Comitê de Superação e do Comitê de Gestão de Fornecedores; Manutenção das atividades de operação e manutenção de forma a garantir a segurança das pessoas e do sistema elétrico; Manutenção dos altos índices de disponibilidade (99,95% no 9M22); Todas as obras dos empreendimentos em construção estão em andamento; algumas já concluídas; Manutenção dos investimentos nos empreendimentos em construção – R$ 2,9 bilhões investidos entre 2020 e 3T22. Preservação da saúde financeira da Companhia Manutenção de posição de liquidez confortável; Adequado perfil de dívida com custos baixos e prazos alongados; A mais alta nota de risco de crédito junto às agências Moody’s e Fitch (AAA na Escala Nacional); Consistente geração operacional de caixa, com manutenção dos baixos níveis de inadimplência históricos da Companhia; Disciplina financeira associada a remuneração adequada aos acionistas; Monitoramento contínuo da inadimplência e dos efeitos da pandemia no setor elétrico."
"Taesa","e","A Transmissora Aliança de Energia Elétrica S.A. (“Taesa” ou “Companhia”; B3: TAEE3, TAEE4, TAEE11), um dos maiores grupos concessionários de transmissão de energia elétrica do país, anuncia hoje seus resultados do terceiro trimestre de 2022. As demonstrações financeiras consolidadas da Companhia são elaboradas e preparadas de acordo com as práticas contábeis do Manual de Contabilidade do Setor Elétrico da Agência Nacional de Energia Elétrica (ANEEL) e com as Normas Internacionais de Relatório Financeiro (IFRS) emitidas pelo International Accounting Standards Board (IASB), definidas neste documento como Resultado Regulatório e Resultado IFRS, respectivamente. A apresentação dessas informações está condizente com as normas expedidas pela Comissão de Valores Mobiliários, aplicáveis à elaboração das Demonstrações Financeiras. No Resultado Regulatório a seguir apresentado, preparado com base na estrutura vigente no Manual de Contabilidade do Setor Elétrico, emitido pela ANEEL, todos os investimentos realizados nas construções das linhas de transmissão e subestações são registrados como ativo imobilizado e os efeitos decorrentes da aplicação do CPC 47 (IFRS 15) são eliminados, incluindo os impactos fiscais (IR e CSLL diferidos e PIS e COFINS diferidos) reconhecidos sobre as diferenças temporárias oriundas da aplicação dessa interpretação. É importante mencionar que o Resultado Regulatório é auditado anualmente na entrega das demonstrações contábeis regulatórias à ANEEL. Portanto, o prazo para conclusão da auditoria das Demonstrações Contábeis Regulatórias (DCRs) se encerram em 30 de abril de cada exercício, ou seja, assuntos relacionados especificamente à contabilidade regulatória divulgados anteriormente a conclusão das DCRs são passíveis de alterações. Para facilitar o entendimento das informações apresentadas neste documento, os termos associados às palavras Regulatório(a) e IFRS seguem os mesmos princípios e estrutura definidos acima para o Resultado Regulatório e Resultado IFRS, respectivamente. Em linha com as normas contábeis, a Taesa não consolida proporcionalmente as empresas controladas em conjunto e coligadas. Dessa forma, os resultados da ETAU, Aimorés, Paraguaçu, Ivaí e do grupo TBE são contabilizados na linha de equivalência patrimonial tanto no Resultado IFRS quanto no Regulatório. A gestão operacional das concessões Transirapé, Transudeste e Transleste (em conjunto, “Transmineiras”) passou a ser realizada pelo grupo TBE. A partir do segundo trimestre de 2022 os resultados das Transmineiras foram incorporados ao resultado da TBE. Para fins de comparação, os respectivos trimestres do ano anterior também sofrerão este ajuste proforma. A declaração de dividendos da Taesa é feita com base no Resultado IFRS revisado pelo auditor."
"O terceiro trimestre de 2022","e","foi marcado pela entrada no novo ciclo da Receita Anual Permitida (RAP) 2022-2023 que se iniciou em 1º de julho. As concessões ajustadas pelo IGP-M (Categoria II) sofreram um reajuste inflacionário de 10,72% e as concessões ajustadas pelo IPCA (Categoria III) sofreram um reajuste inflacionário de 11,73%. Assim, a RAP das 41 concessionárias do grupo Taesa no novo ciclo 2022-2023 totalizou R$ 3,8 bilhões, 7,7% maior que a RAP total do ciclo anterior, já contemplando a redução de 50% da RAP das concessões de categoria II que sofrem esse efeito no novo ciclo."
"A Companhia registrou","e","portanto, uma receita operacional líquida regulatória de R$ 583,9 MM no 3T22 e de R$ 1.670,1 MM no 9M22, apresentando um crescimento de 17,4% e 29,8% na comparação com os respectivos períodos de 2021. Já o EBITDA regulatório da Companhia totalizou R$ 498,1 MM no 3T22 e R$ 1.417,4 MM no 9M22, apresentando um crescimento de 18,3% e de 32,6% contra o 3T21 e 9M21, respectivamente. Assim, a margem EBITDA ficou em 85,3% no trimestre e 84,9% no acumulado. O lucro líquido regulatório também apresentou um crescimento anual de 94,6% no 3T22 e de 60,7% no 9M22, totalizando R$ 373,7 MM e R$ 661,6 MM, respectivamente, resultado da entrada em operação dos projetos de Janaúba, Sant’Ana (parcial), ESTE, Aimorés e Paraguaçu, do reajuste inflacionário do novo ciclo da RAP e da melhora do resultado financeiro. "
"IFRS","e","No resultado em IFRS, a Companhia registrou um lucro líquido de R$ 302,5 MM no trimestre e de R$ 1.426,4 MM no acumulado do ano, uma redução de 43,7% e 20,3% na comparação com os respectivos períodos de 2021, explicada principalmente pelo menor IGP-M e IPCA registrado entre os períodos comparados, que afetaram negativamente a receita de correção monetária, e a redução da margem de implementação de infraestrutura, principalmente em função da entrada em operação de Janaúba, ESTE e Aimorés e dos menores investimentos nos empreendimentos em construção Ivaí e Sant’Ana."
"Primeiros nove meses","e","A Taesa encerrou os primeiros nove meses do ano com um caixa robusto de R$ 1,8 bilhão e uma dívida líquida de R$ 8,9 bilhões – considerando a participação da Companhia nas empresas controladas em conjunto e coligadas –, com um índice de 3,7x na relação dívida líquida sobre EBITDA, uma importante melhora quando comparado ao nível de 4,3x reportado doze meses antes. Do ponto de vista operacional, a Companhia manteve um alto índice de disponibilidade das linhas, em 99,95%, e uma parcela variável contábil de R$ 30,3 MM no acumulado do ano, destacando sua consistência na excelência operacional e gestão de suas linhas de transmissão. Seguimos dedicados e priorizando os nossos empreendimentos em construção. Concluímos os empreendimentos de ESTE em fevereiro, Aimorés em maio e Paraguaçu em julho e adiantamos uma parte de Sant’Ana em abril, que juntos adicionam uma RAP de cerca de R$ 224,5 MM para a Companhia (ciclo 2022-2023). Os projetos de Ivaí e Sant’Ana se encontram em estágio avançado de execução, Ananaí teve seus investimentos iniciais e o contrato de concessão de Pitiguari, referente ao lote 2 arrematado no leilão de junho deste ano, foi assinado em 30 de setembro de 2022. Por fim, com base nas demonstrações financeiras intermediarias de 30 de setembro de 2022, o Conselho de Administração aprovou hoje a distribuição de (i) R$ 45,2 MM (R$ 0,13 / Unit) a título de dividendos intercalares, (ii) R$ 113,4 MM (R$ 0,33 / Unit) a título de dividendos intermediários referente a Reserva Especial de dividendos não distribuídos, e (ii) R$ 206,8 MM (R$ 0,60 / Unit) a título de juros sobre capital. próprio (JCP), totalizando R$ 365,4 MM (R$ 1,06 / Unit). O pagamento ocorrerá no dia 5 de dezembro de 2022, a partir da data base de 14 de novembro de 2022. "
"missão","e","Conectamos o Brasil com energia segura e confiável."
"visão","e","Ser a transmissora de energia elétrica de maior Valor para a sociedade."
"valores","e","Cuidamos genuinamente das pessoas. Agimos com integridade construindo relações de confiança. Buscamos a excelência em tudo o que fazemos. A TAESA somos nós!"
"resultado regulatório","e","A receita líquida totalizou R$ 583,9 MM no 3T22, registrando um crescimento de 17,4% em relação ao mesmo período de 2021, explicado pelo reajuste inflacionário do ciclo da RAP 2022-2023 e entrada em operação de Janaúba e parcial de Sant’Ana. O EBITDA totalizou R$ 498,1 MM, apresentando um aumento anual de 18,3%. A margem EBITDA ficou em 85,3% no trimestre (+0,7pp contra 3T21). Crescimento de 147,5% na equivalência patrimonial, explicado pelas menores despesas financeiras em Ivaí, em função da deflação do IPCA, pelo reajuste inflacionário do ciclo da RAP 2022-2023 e pela entrada em operação de ESTE, Aimorés e Paraguaçu. Redução de 62,7% nas despesas financeiras líquidas, resultado basicamente da contração do índice IPCA, que registrou deflação no 3T22. Lucro líquido ficou em R$ 373,7 MM no 3T22, 94,6% maior que o mesmo período do ano anterior. Em 30 de setembro de 2022, a dívida bruta da Companhia encerrou em R$ 8.499,8 MM, uma redução de 0,2% contra o 2T22. O caixa da Companhia ficou em R$ 1.574,5 MM (redução de 15,1% versus 2T22), resultando em uma dívida líquida de R$ 6.925,3 MM (aumento de 4,0% no trimestre). A relação da dívida líquida / EBITDA da Taesa, consolidando proporcionalmente as empresas controladas em conjunto e coligadas, ficou em 3,7x (em linha com 3,8x no 2T22). Índice de disponibilidade foi de 99,95% e uma Parcela Variável (PV) contábil de R$ 30,3 MM, equivalente a 1,62% da RAP, no 9M22."
"estrutura societária","e","As 41 concessões/participações de transmissão detidas pela Taesa estão segregadas em: (i) 10 concessões que compõem a empresa holding (TSN, Novatrans, ETEO, GTESA, PATESA, Munirah, NTE, STE, ATE e ATE II); (ii) 12 investidas integrais (ATE III, Brasnorte, São Gotardo, Mariana, Miracema, Janaúba, Sant’Ana, São João, São Pedro, Lagoa Nova, Ananaí e Pitiguari); e (iii) 19 participações (ETAU, AIE e TBE). A gestão operacional das concessões Transirapé, Transudeste e Transleste (em conjunto, “Transmineiras”) passou a ser realizada pelo grupo TBE. A partir do segundo trimestre de 2022, os resultados das Transmineiras serão incorporados ao resultado da TBE. Para fins de comparação, os respectivos trimestres do ano anterior também sofrerão este ajuste proforma. Há 4 empreendimentos (Sant’Ana, Ivaí, Ananaí e Pitiguari) que estão em fase não operacional. Em 27 de julho de 2022, o empreendimento de Paraguaçu obteve o termo de liberação pela ONS, o qual autoriza o recebimento de R$ 78,6 milhões de RAP para a Companhia de acordo com o ciclo RAP 2022-2023. Paraguaçu é um empreendimento referente ao lote 3, do leilão de transmissão nº 013/2015 (parte 2), realizado em outubro de 2016, em que a Taesa participa em sociedade, na proporção igualitária de 50%. A concessão possui uma RAP total de R$ 157,3 milhões para o ciclo 2022-2023 e está localizada nos estados de Minas Gerais e Bahia, com extensão de 338 km de linha com tensão de 500 kV, interligando a subestação Poções III à subestação Padre Paraíso 2. Em 30 de junho de 2022, a Taesa sagrou-se vencedora na disputa pelo lote 10 do Leilão de Transmissão ANEEL 01/2022, situado em Santa Catarina, com extensão de 92,7 km, sendo 66,7 km de circuito duplo e um investimento previsto de R$ 243,2 MM (Capex ANEEL). O novo empreendimento, chamado de Pitiguari Transmissora de Energia Elétrica S.A. (“Pitiguari”), terá um prazo regulatório de 54 meses para conclusão e acrescentará para a Companhia uma RAP de R$ 19,5 milhões a partir da sua entrada em operação. O empreendimento foi assumido formalmente pela Companhia em 30 de setembro de 2022, quando o contrato de concessão foi assinado. Em 6 de maio de 2022, o empreendimento de Aimorés entrou em operação comercial, passando a adicionar o valor de R$ 52,7 milhões de RAP para a Companhia de acordo com o ciclo RAP 2022-2023. Aimorés é um empreendimento referente ao lote 4, do leilão de transmissão nº 013/2015 (parte 2), realizado em outubro de 2016, em que a Taesa participa em sociedade, na proporção igualitária de 50%. A concessão possui uma RAP total de R$ 105,4 milhões para o ciclo 2022-2023 e está localizada no estado de Minas Gerais, com extensão de 208 km de linha com tensão de 500 kV, interligando a subestação Padre Paraíso 2 à subestação Governador Valadares 6. Em 1º de abril de 2022, o empreendimento de Sant’Ana obteve os termos de liberação para as linhas de transmissão LT Livramento 3 – Alegrete 2 (C1) e LT Livramento 3 – Cerro Chato (C1), ambas com tensão de 230 kV, e para parte da subestação SE 230 kV Livramento 3. Com isso, as instalações entraram em operação comercial com uma antecipação de quase 12 meses em relação ao prazo ANEEL, passando a adicionar para a Companhia uma RAP de mais de 23% da RAP total do empreendimento, retroativa a 28 de março de 2022. Sant’Ana é um empreendimento do lote 12, do leilão de transmissão nº 004/2018, realizado em dezembro de 2018, 100% controlada pela Taesa, e apresenta uma RAP total de R$ 77,8 milhões para o ciclo 2022-2023 e um Capex ANEEL de R$ 610 milhões. O empreendimento está localizado no Estado do Rio Grande do Sul, com extensão aproximadamente de 591 km de linhas de transmissão. Em 18 de fevereiro de 2022, o empreendimento de ESTE obteve o termo de liberação pela ONS, o qual autoriza o recebimento de receita a partir de 9 de fevereiro de 2022, passando a adicionar para a Taesa uma RAP de R$ 74,5 milhões (ciclo 2022-2023). ESTE é um empreendimento do lote 22, do leilão de transmissão nº 013/2015 (parte 2), realizado em outubro de 2016, 100% controlada pela subsidiária EATE, na qual a Taesa possui de 49,98% do capital social total. A ESTE possui uma RAP total de R$ 149,0 milhões para o ciclo 2022-2023 e está localizada entre os"
"queda de 50% da RAP","e","Os contratos de concessão de transmissão licitados entre 1999 e 2006 (Categoria II) preveem a redução de 50% da RAP (Rede Básica) a partir do 16º ano de operação comercial das instalações. Dado que os contratos de concessão possuem instalações cuja parcela de RAP associada será reduzida em 50% em datas distintas ao longo do seu ciclo, foi calculada uma RAP equivalente a ser recebida pelas concessionárias ao longo do referido ciclo, e nos ciclos futuros, considerando os valores pro-rata das parcelas de RAP sem redução, desde o início do ciclo (1º de julho) até a data de fim do 15º ano de operação comercial das instalações, e os valores pro-rata das parcelas de RAP com redução de 50%, a partir da data de início do 16º ano de operação comercial das instalações até o final do mesmo ciclo (30 de junho). Para os ciclos 2016-2017, 2017-2018, 2018-2019, 2019-2020, 2020-2021, 2021-2022 e 2022-2023, as seguintes concessões atingiram o 16º ano de operação¹: ETEO: 100% da RAP da ETEO entrou no 16º ano de operação em 19/10/2016. ECTE3 : 67,6% da RAP da ECTE entrou no 16º ano de operação em 9/3/2017 e 28,4% da RAP entrou em 26/3/2017. ETEP3 : 99,7% da RAP da ETEP entrou no 16º ano de operação em 25/8/2017. EATE3 : 19,0% da RAP da EATE entrou no 16º ano de operação em 1/2/2018, 45,6% da RAP em 20/2/2018, e 33,5% da RAP em 10/3/2018. TSN3 : 89,9% da RAP da TSN entrou no 16º ano de operação em 4/3/2018, 4,0% da RAP em 5/4/2018, 0,7% da RAP em 22/5/2018, e 1,3% da RAP em 3/6/2018. Novatrans: 16,3% da RAP da Novatrans entrou no 16º ano de operação em 3/6/2018, 19,4% da RAP em 8/12/2018, 19,1% da RAP em 23/12/2018, e 45,2% da RAP em 8/4/2019. GTESA: 100% da RAP da GTESA entrou no 16º ano de operação em 26/8/2018. NTE: 100% da RAP da NTE entrou no 16º ano de operação em 25/1/2019. STE3 : 19,0% da RAP da STE entrou no 16º ano de operação em 27/6/2019, 36,6% da RAP em 13/7/2019, e 42,1% da RAP em 18/7/2019. PATESA3 : 98,2% da RAP da PATESA entrou no 16º ano de operação em 1/9/2019. ERTE3 : 71,5% da RAP da ERTE entrou no 16º ano de operação em 15/9/2019. ENTE: 100% da RAP da ENTE entrou no 16º ano de operação em 12/2/2020. ETAU3 : 34,2% da RAP da ETAU entrou no 16º ano de operação em 17/4/2020 e 36,0% da RAP em 29/9/2020. Munirah: 100% da RAP da Munirah entrou no 16º ano de operação em 30/10/2020. ATE I: 54,0% da RAP da ATE I entrou no 16º ano de operação em 8/10/2020 e 46,0% da RAP em 27/10/2020. Transleste: 100% da RAP da Transleste entrou no 16º ano de operação em 18/12/2020. ATE II: 100% da RAP da ATE II entrou no 16º ano de operação em 11/12/2021. Transudeste: 100% da RAP da Transudeste entrou no 16º ano de operação em 23/2/2022. Transirapé3 : 45,1% da RAP da Transirapé entrou no 16º ano de operação em 23/5/2022 e 15,9% da RAP em 30/5/2022. Lumitrans3 : 99,9% da RAP da Lumitrans entrou no 16º ano de operação em 3/10/2022. STC3 : 71,9% da RAP da STC entrou no 16º ano de operação em 8/11/2022."
"Dividendos e Juros sobre Capital Próprio","e","No dia 31 de maio de 2022, a Taesa pagou o total de R$ 800,3 MM (R$ 2,32 / Unit) segregados da seguinte forma: (i) R$ 147,0 MM a título de dividendos mínimos obrigatórios remanescentes de 2021 e R$ 653,3 MM a título de dividendos adicionais referente à destinação do lucro líquido de 2021. Com isso, o montante total de proventos distribuídos sobre o resultado de 2021 foi de R$ 1.789,9 MM, registrando um payout de 80,9%. No dia 26 de agosto de 2022, a Taesa pagou o total de (i) R$ 308,8 MM (R$ 0,90 / Unit) a título de dividendos intercalares, e (ii) R$ 197,9 MM (R$ 0,57 / Unit) a título de juros sobre capital próprio (JCP), totalizando R$ 506,7 MM (R$ 1,47 / Unit), com base nas demonstrações financeiras intermediárias de 31 de março de 2022. Adicionalmente, com base nas demonstrações financeiras intermediárias de 30 de setembro de 2022, o Conselho de Administração da Companhia aprovou hoje a distribuição de (i) R$ 45,2 MM (R$ 0,13 / Unit) a título de dividendos intercalares, (ii) R$ 113,4 MM (R$ 0,33 / Unit) a título de dividendos intermediários referente a Reserva Especial de dividendos não distribuídos, e (iii) R$ 206,8 MM (R$ 0,60 / Unit) a título de juros sobre capital próprio (JCP), totalizando R$ 365,4 MM (R$ 1,06 / Unit). O pagamento ocorrerá no dia 5 de dezembro de 2022, a partir da data base de 14 de novembro de 2022."
"Impostos","e", "A redução de 90,3% do Imposto de Renda e Contribuição Social em IFRS reconhecido no resultado entre o 3T22 e 3T21 é explicada basicamente pela queda no lucro antes dos impostos e pelo pagamento de JCP neste trimestre. Estes efeitos foram compensados em parte pelo menor aproveitamento do benefício fiscal SUDAM/SUDENE e pela queda no lucro das empresas que possuem tributação em regime de lucro presumido, principalmente em Sant’Ana."
"Resultado Financeiro Líquido","e", "A despesa financeira líquida IFRS totalizou R$ 85,8 MM no 3T22, 62,8% menor que o registrado no 3T21. Já a despesa financeira líquida regulatória totalizou R$ 85,6 MM, 62,7% menor na comparação anual. Nos primeiros nove meses de 2022 a despesa financeira líquida IFRS fechou em R$ 574,5 MM, apresentando uma redução de 2,1% contra 9M21. A despesa financeira líquida regulatória alcançou R$ 576,0 MM, 1,4% menor que o mesmo período de 2021. O aumento anual de R$ 45,9 MM nas Receitas Financeiras ocorreu em função de aumento no volume de caixa aplicado, decorrente da 12ª emissão de debêntures no valor de R$ 1.250 MM e o aumento do CDI entre os períodos comparados (3,26% no 3T22 x 1,21% no 3T21). O crescimento de 50,0% na linha de juros incorridos se deve, basicamente, ao aumento do volume médio da dívida causado pelas 11ª e 12ª emissões de debêntures e pelo aumento do CDI entre os períodos, compensado em parte, pela deflação registrada entre os períodos comparados (IPCA de -1,32% no 3T22 x 3,02% no 3T21). A redução anual de R$ 172,0 MM na linha de variações monetárias e cambiais é explicada pela deflação registrada entre os períodos comparados associado ao aumento da dívida bruta indexada ao IPCA. A redução anual de R$ 11,2 MM na linha de ajuste ao valor justo é decorrente da liquidação antecipada da dívida 4.131, marcada a mercado. A linha de outras despesas financeiras apresentou um crescimento de R$ 7,6 MM na comparação anual explicado, basicamente, pelo PIS/COFINS sobre uma maior receita financeira entre os períodos comparados e o pagamento de multas. "
"Resultado de Equivalência Patrimonial IFRS","e","O Resultado de Equivalência Patrimonial IFRS no 3T22 totalizou R$ 118,2 MM, 20,4% menor que o 3T21. Já nos primeiros nove meses de 2022, a Equivalência Patrimonial IFRS fechou em R$ 554,9 MM, 12,4% menor que o mesmo período de 2021. A redução de 20,4% no resultado IFRS das investidas em conjunto e coligadas, na comparação entre o 3T22 e o 3T21, se deve principalmente a: (i) redução da receita de correção monetária em função de um menor IGP-M e IPCA, com maior impacto na TBE e em Aimorés; e (ii) menores investimentos em Ivaí, Aimorés e TBE (ESTE). Estes efeitos foram compensados em parte por (i) menores despesas financeiras em Ivaí, impactada pela deflação do IPCA acumulada no período, (ii) maiores investimentos no projeto de Paraguaçu entre os períodos comparados, e (iii) contabilização da correção monetária acumulada durante o período da construção de Paraguaçu, alocada na receita de implantação de infraestrutura do projeto assim que ele entra em operação."
"Resultado de Equivalência Patrimonial Regulatória","e", "O Resultado de Equivalência Patrimonial Regulatória no 3T22 totalizou R$ 81,2 MM, 147,5% maior que o registrado no 3T21. Nos primeiros nove meses de 2022, a Equivalência Patrimonial Regulatória fechou em R$ 144,9 MM, 38,9% maior que o registrado no 9M21. O Resultado de Equivalência Patrimonial Regulatória no 3T22 apresentou um aumento de R$ 48,4 MM na comparação anual. Este desempenho é explicado pelas (i) menores despesas financeiras na concessão de Ivaí em função da deflação do IPCA, (ii) reajuste inflacionário do ciclo da RAP 2022-2023 (10,72% em IGP-M e 11,73% em IPCA), e (iii) entrada em operação de ESTE (TBE), Aimorés e Paraguaçu. Estes efeitos foram compensados em parte pelas maiores despesas financeiras da TBE, motivado pelas novas captações no Grupo e pelas provisões de PVA devido ao atraso na entrega dos projetos de Aimorés e Paraguaçu. A diferença entre o Resultado de Equivalência Patrimonial na Taesa e a soma do resultado da ETAU, Aimorés, Paraguaçu, Ivaí, Transmineiras e TBE é devido à amortização do ágio oriundo da alocação do preço pago pela aquisição da TBE."
